{
  "$schema": "react-native-android-setup.config.schema.json",
  "_description": "Host environment profile for react-native-android-setup. Re-read and validated at every invocation by SKILL.md Step 0. Every pinned version, URL, package ID and command the skill uses lives here; SKILL.md names fields, never values.",
  "version": "1.0.0",
  "source": {
    "evidence": "rubrical-works/idpf-phm-project-templates#3 (Proposal: Host Environment Profiles), lessons 1-12, observed 2026-10-13 to 2026-10-16",
    "pilotStack": {
      "reactNative": "0.84.1",
      "maestro": "2.11.0",
      "hostOs": "windows"
    },
    "_statusNote": "status 'verified' means the lesson was observed and its fix confirmed on a Windows host during the pilot. All pilot evidence is Windows-only, so every macOS and Linux entry is 'declared-but-untested' until a run on that OS confirms it."
  },
  "toolRoot": {
    "question": "Where should the Android SDK, emulator (AVD) images, Maestro and tool temp folders live? Give an absolute folder path on a drive with room for them (the pilot used about 51 GB for the SDK and AVD images).",
    "default": null,
    "_noDefault": "No default, by decision of the pilot: the default location is what filled the system drive (lessons 5-6). Ask on every invocation that has no recorded answer.",
    "pathSeparator": "/",
    "normalize": "Replace every backslash in the user's answer with a forward slash and strip a trailing slash before deriving paths (lesson 7)."
  },
  "paths": {
    "sdk": "{toolRoot}/Android/Sdk",
    "avd": "{toolRoot}/Android/avd",
    "maestro": "{toolRoot}/maestro",
    "maestroTemp": "{toolRoot}/MaestroTemp"
  },
  "resume": {
    "stateFile": "{home}/.react-native-android-setup/state.json",
    "records": ["toolRoot", "platform", "pendingAdminItems", "rebootRequired", "completedItems"],
    "_note": "Written before the admin phase asks for a reboot. A later invocation that finds it offers to continue with the recorded tool root (the user's own earlier answer, confirmed, not a default) and re-checks every item."
  },
  "sdkPackages": {
    "resolveFrom": {
      "file": "android/build.gradle",
      "fields": ["compileSdkVersion", "buildToolsVersion"],
      "_note": "React Native projects declare these in the ext block of android/build.gradle. No pinned fallback: when the project file is absent or silent, ask the user rather than guess."
    },
    "always": ["platform-tools", "emulator"],
    "templates": {
      "platform": "platforms/android-{compileSdkVersion}",
      "buildTools": "build-tools/{buildToolsVersion}",
      "systemImage": "system-images/android-{apiLevel}/{tag}/{abi}"
    },
    "systemImageDefaults": {
      "tag": "google_apis",
      "abi": "x86_64",
      "_note": "apiLevel is asked per AVD; the pilot used Android 7 (API 24) and Android 13+ images."
    }
  },
  "cliSyntax": {
    "sdkmanager": {
      "packageSeparator": "/",
      "_lesson": 3,
      "_note": "sdkmanager is given slash package paths (platforms/android-35)."
    },
    "avdmanager": {
      "packageSeparator": ";",
      "powershellStopParsing": "--%",
      "_lesson": 3,
      "_note": "avdmanager wants semicolon package paths (system-images;android-35;google_apis;x86_64); from PowerShell the semicolons end the statement unless the arguments follow the stop-parsing token."
    }
  },
  "downloads": {
    "cmdlineTools": {
      "repositoryIndex": "https://dl.google.com/android/repository/repository2-3.xml",
      "archives": {
        "windows": "https://dl.google.com/android/repository/commandlinetools-win-16111833_latest.zip",
        "macos": "https://dl.google.com/android/repository/commandlinetools-mac-15641748_latest.zip",
        "linux": "https://dl.google.com/android/repository/commandlinetools-linux-16111833_latest.zip"
      },
      "installLayout": "{paths.sdk}/cmdline-tools/latest",
      "_note": "Build numbers are the highest listed in repositoryIndex on 2026-10-17. The archive unpacks to a cmdline-tools folder whose contents belong in installLayout."
    },
    "maestro": {
      "version": "2.11.0",
      "archive": "https://github.com/mobile-dev-inc/Maestro/releases/download/cli-2.11.0/maestro.zip",
      "checksums": "https://github.com/mobile-dev-inc/Maestro/releases/download/cli-2.11.0/checksums_sha256.txt",
      "flatten": "The zip holds a top-level maestro folder; its contents go directly in {paths.maestro} so the launcher sits at {paths.maestro}/bin."
    }
  },
  "metro": {
    "defaultPort": 8081,
    "alternativePort": 8088
  },
  "items": [
    {
      "id": "jdk-17",
      "kind": "tool",
      "lessons": [1],
      "summary": "JDK 17 toolchain. React Native 0.84's Gradle plugin needs a 17 toolchain; JDK 25 alone triggers foojay resolver 0.5.0's JvmVendorSpec.IBM_SEMERU crash under Gradle 9.",
      "requiredVersion": "17",
      "platforms": {
        "windows": {
          "status": "verified",
          "check": "& \"$env:JAVA_HOME/bin/java.exe\" -version  # expect a version string starting 17",
          "apply": "winget install --id EclipseAdoptium.Temurin.17.JDK --exact",
          "requiresAdmin": true,
          "requiresReboot": false
        },
        "macos": {
          "status": "declared-but-untested",
          "check": "\"$JAVA_HOME/bin/java\" -version  # expect a version string starting 17",
          "apply": "brew install --cask temurin@17",
          "requiresAdmin": true,
          "requiresReboot": false
        },
        "linux": {
          "status": "declared-but-untested",
          "check": "\"$JAVA_HOME/bin/java\" -version  # expect a version string starting 17",
          "apply": "sudo apt-get install -y openjdk-17-jdk",
          "requiresAdmin": true,
          "requiresReboot": false
        }
      }
    },
    {
      "id": "env-java-home",
      "kind": "envVar",
      "lessons": [1, 2, 4],
      "summary": "JAVA_HOME as a user variable pointing at the JDK 17 home. Gradle and Maestro both read it.",
      "variable": "JAVA_HOME",
      "value": "{jdk17Home}",
      "valueFrom": "The home folder of the JDK 17 that jdk-17 installed or found (the folder containing bin/java), written with forward slashes.",
      "dependsOn": ["jdk-17"],
      "platforms": {
        "windows": {
          "status": "verified",
          "check": "[Environment]::GetEnvironmentVariable('JAVA_HOME','User')",
          "apply": "[Environment]::SetEnvironmentVariable('JAVA_HOME','{value}','User')",
          "requiresAdmin": false,
          "requiresReboot": false
        },
        "macos": {
          "status": "declared-but-untested",
          "check": "grep -n '^export JAVA_HOME=' ~/.zshrc",
          "apply": "echo 'export JAVA_HOME=\"{value}\"' >> ~/.zshrc",
          "requiresAdmin": false,
          "requiresReboot": false
        },
        "linux": {
          "status": "declared-but-untested",
          "check": "grep -n '^export JAVA_HOME=' ~/.profile",
          "apply": "echo 'export JAVA_HOME=\"{value}\"' >> ~/.profile",
          "requiresAdmin": false,
          "requiresReboot": false
        }
      }
    },
    {
      "id": "sdk-folder",
      "kind": "folder",
      "lessons": [5],
      "summary": "The Android SDK folder under the tool root, off the system drive.",
      "path": "{paths.sdk}",
      "platforms": {
        "windows": {
          "status": "verified",
          "check": "Test-Path '{paths.sdk}'",
          "apply": "New-Item -ItemType Directory -Force '{paths.sdk}'",
          "requiresAdmin": false,
          "requiresReboot": false
        },
        "macos": {
          "status": "declared-but-untested",
          "check": "test -d '{paths.sdk}'",
          "apply": "mkdir -p '{paths.sdk}'",
          "requiresAdmin": false,
          "requiresReboot": false
        },
        "linux": {
          "status": "declared-but-untested",
          "check": "test -d '{paths.sdk}'",
          "apply": "mkdir -p '{paths.sdk}'",
          "requiresAdmin": false,
          "requiresReboot": false
        }
      }
    },
    {
      "id": "cmdline-tools",
      "kind": "tool",
      "lessons": [3],
      "summary": "Android command-line tools (sdkmanager, avdmanager) unpacked into the SDK's cmdline-tools/latest folder.",
      "dependsOn": ["sdk-folder", "env-java-home"],
      "platforms": {
        "windows": {
          "status": "verified",
          "check": "& '{paths.sdk}/cmdline-tools/latest/bin/sdkmanager.bat' --version",
          "apply": [
            "Download downloads.cmdlineTools.archives.windows",
            "Expand-Archive <downloaded zip> -DestinationPath '{paths.sdk}/cmdline-tools-unpack'",
            "Move-Item '{paths.sdk}/cmdline-tools-unpack/cmdline-tools' '{paths.sdk}/cmdline-tools/latest'"
          ],
          "requiresAdmin": false,
          "requiresReboot": false
        },
        "macos": {
          "status": "declared-but-untested",
          "check": "'{paths.sdk}/cmdline-tools/latest/bin/sdkmanager' --version",
          "apply": [
            "Download downloads.cmdlineTools.archives.macos",
            "unzip <downloaded zip> -d '{paths.sdk}/cmdline-tools-unpack'",
            "mkdir -p '{paths.sdk}/cmdline-tools' && mv '{paths.sdk}/cmdline-tools-unpack/cmdline-tools' '{paths.sdk}/cmdline-tools/latest'"
          ],
          "requiresAdmin": false,
          "requiresReboot": false
        },
        "linux": {
          "status": "declared-but-untested",
          "check": "'{paths.sdk}/cmdline-tools/latest/bin/sdkmanager' --version",
          "apply": [
            "Download downloads.cmdlineTools.archives.linux",
            "unzip <downloaded zip> -d '{paths.sdk}/cmdline-tools-unpack'",
            "mkdir -p '{paths.sdk}/cmdline-tools' && mv '{paths.sdk}/cmdline-tools-unpack/cmdline-tools' '{paths.sdk}/cmdline-tools/latest'"
          ],
          "requiresAdmin": false,
          "requiresReboot": false
        }
      }
    },
    {
      "id": "sdk-packages",